title,text,score,num_comments,created_utc
Me estrellé contra el mundo y esta fue mi experiencia,"Hola, soy relativamente nuevo aquí, tengo la cuenta desde 2021 pero realmente empecé a entrar a reddit seguidamente hace más o menos 2 meses, he visto que muchas personas comparten sus experiencias personales y por tanto, quise compartir la mía, realmente no espero recibir ningún consejo ni nada, aunque siempre son bienvenidos, solo quiero desahogarme y contar mi historia, y en el caso en que de algún modo pueda ayudar a alguien que esté pasando por una situación similar, también me alegraría.

Tengo 21 años y estudio diseño gráfico, realmente soy consciente de que he sido muy privilegiado en la vida, siempre estudié, siempre tuve tiempo para mí, jamás tuve que trabajar para pagar mi carrera, y si trabajaba solo lo hacía en vacaciones, en el restaurante de mis primos o la empresa de mi mamá, para ganar dinero para comprar, un celular, unos zapatos, un videojuego, cualquier gusto que quisiera darme, y ese fue mi vida durante toda mi etapa de universidad y colegio. Todo eso cambió justamente este semestre, ya me encuentro próximo a graduarme y mi universidad me exige realizar prácticas durante 6 meses cómo requisito para graduarme, durante el primer mes y medio todo iba muy bien, pero luego empecé a caer en cuenta de que mi vida tal y como la conocía se había acabado, a pesar de ser prácticas o pasantías, es un horario de oficina, de lunes a viernes de 7:30 a.m a 5:00 p.m, empecé a caer en la rutina, empecé a tener menos tiempo para mi para las cosas, y aunque si hago mi labor de diseñador en la empresa, gran parte del tiempo es pegado al computador, haciendo informes, llenando formatos de excel, teniendo la rutina día tras día. Puede parecer un simple capricho, una bobada, soy consciente de que muchos aquí es su día a día, pero a mi realmente me pegó muy duro este cambio de vida, no sé si haya un diseñador leyendo esto o si su experiencia en la universidad haya sido la misma, pero durante mi carrera realizaba todo tipo de cosas, grabar películas, programar videojuegos,  hacer ilustraciones o videoclips, y todo eso sumado a la vida social, el hablar con mis amigos, compartir tiempo con ellos, o simplemente quedarme los días que no tenía clase en casa viendo series o jugando, pero que todo eso haya acabado de un momento a otro, me dió muy duro, enfrentarme al mundo real, a la vida laboral era algo para lo que no estaba preparado, y caí en una depresión muy fuerte, teniendo que ir incluso con un proceso psicológico porque me sentía muy vacío y ansioso.

Muchos de mis amigos y conocidos que si han tenido que trabajar desde muy temprano me han dicho que estoy sobreactuando, que es lo que nos toca a todos y que hay gente que le toca peor, que trabaja de domingo a domingo, en la noche, que tuvieron que trabajar incluso mientras estudiaban en la universidad, y que les pagan una miseria o hay practicantes a los que no les pagan, cosa que a mi si me pagan, el mínimo, pero por lo que tengo entendido para un estudiante es muy difícil complejo conseguir practicas pagas, en fin, soy consciente de mis privilegios y de que hay gente con un trabajo mucho más pesado, pero aún así eso no quita que me haya sentido muy mal.

Ya estoy por finalizar, inicié en febrero y la práctica va hasta julio, estos 5 meses han sido complicados y como dije, no estoy aquí para recibir un consejo, solo contar mi experiencia, tengo la ligera esperanza de poder ser un diseñador freelance cuando acabe mi carrera y mi práctica, incluso aprovechar que ya casi recibo mi pase para trabajar algunos días en plataforma, no lo sé, cualquier cosa pero tengo claro que esta vida de oficina y rutina no es la que quiero, sin embargo, también me quedó claro que la vida no es color de rosas, y enfrentarse al mundo real es algo duro, cuando no se está preparado.",1,3,1719190372.0
Que piensan de leer pero pensando en plan como SI fuera una vez random que TE imaginas leyendo,,0,1,1719190016.0
Me cuesta hablar con cualquiera persona ¿algún consejo?,"
Hola tengo 26 y la verdad a la hora de hablar con alguien me cuesta mucho, por lo general cuando  hablo sobre mi o alguno tema en especifico no duro mucho  hablando me quedo sin tema de conversación  muy rápido siento que aburro a las personas y por esa razón tampoco conozco mucha gente, mis amigos siempre me recuerdan  que soy muy callado y que debería de hablar más, punto es que soy bueno escuchándo, Quisiera un consejo para mejorar esta situación  para ser un mejor conversador.",2,2,1719189553.0
Torre o portatil gamer,"Voy a renovar mi pc que ya no da y quisiera su opinión, porfa. Estoy inclinado al portatil pero no sé, además ahora he encontrado páginas (importadores y empresas acá en Col) que los venden de exhibición o refurbished (hablando de portatiles) y sales más baratos. Me alcanza máximo para el alienware más bajito, pero cuál elegirían ustedes...",5,6,1719189086.0
Ayuda.,"Alguien que me ayude a crear una canción.
Pasa que tengo ideas, pero no sé cómo conectarlas o cómo hacer atractiva la letra y me serviría mucho que alguien me ayude.

Les agradezco.",1,1,1719188970.0
Entrenar poco tiempo funciona?,"Tengo una duda pues verán yo odio con toda mi alma el día de pierna, y pues pensé que talvez no tenga que hacer entrenamientos de pierna muy largos, si lo reparto para toda la semana ejemplo cada día de la semana me hago unas series de pierna para trabajar cada día un músculo de la pierna distinto para no tener que hacer todo ese ejercicio tan agotador en un día, creen que funcione?",0,2,1719188229.0
Mejores prostíbulos de Colombia?,,0,13,1719186148.0
Donde estudiar Italiano?,"Hola buenas tardes
¿conocen algún instituto o academia en la que pueda aprender italiano? Desde hace mucho quiero aprender pero en mi ciudad no hay muy buenas academias.",3,1,1719184379.0
Alguien de la costa que me recomiende un suero costeño de algún almacén de cadena. 🤔,,1,1,1719183578.0
Arreglar el error de ps4: CE-33567-4,Ya probe de todo y al inicializar con usb llega al 99% y me da ese error porfavor ayuda,0,2,1719180802.0
Cuanto se demora un desalojo? ,"Tenemos una casa que lleva rentada mas o menos 10 años, pero ya queremos pasarnos a vivir nosotros ahi, la actual arrendataria se rehusa a entregar la casa, ya se puso proceso en el juzgado, y de hecho ya tenemos la sentencia donde le dan 10 dias para entregar el inmueble, o se va con lanzamiento con la policía. Ya se le informó y ella dijo que de ahi solo la sacan con policía. 

Ella esta segura que la policia no la va a sacar por que el papa es discapacitado y vive ahí. 

Hasta que punto puedo empezar a hacer presión para que se vaya mientras llega la policía ya que no sabemos cuanto se va a demorar. 

Puedo publicar en redes que esta de ilegal ahi? Puedo voletearla? Puedo pegar en las paredes de la casa que ella esta ahi ilegal? Puedo repartir copias de la sentencia a todo el barrio para que también le hagan presión para que se vaya? 

Cuanto se demora un proceso de lanzamiento con la policía? 

Por la sentencia se supone que tiene que entregar la vivienda el jueves 27 de Junio. Mas o menos cuando puedo esperar tener la casa en mi poder? 

Muchas gracias de antemano",0,3,1719178356.0
Resolvamos esto gente fitness: bodytech o smart fit? Justifiquen su respuesta:,,0,14,1719177617.0
"Voy a tener relaciones por primera vez, y no me gusta mi fisico, algun consejo?",,0,10,1719176089.0
Nunca me funcionan las relaciones ,Tengo 15 años la verdad nunca e tenido una relación como tal no me considero ni muy feo ni muy lindo la verdad nosé si no les gusta mi forma de actuar aveces soy muy canson en el tema por ejemplo en el colegio jodo mucho y aveces se q me comportó un poquito pasado se la raya y con la muchachas q he querido tener una relación nunca me funciona aveces creo q mi actitud no les gusta y quiero cambiar pero la verdad a sido muy díficil para mí ya q me siento bien como soy nosé si me den algún consejo o nosé. ,0,11,1719175916.0
Pregunta para las mujeres cuales la mejor manera para que un hombre pueda acercarse a ustedes? ,"pregunto esto porque en mi caso no tengo mucha confianza y me resulta difícil comenzar  una conversación con una persona que no conozco, pero desgrasiadamente el que no busca no encuentra y me gustaría saber  cuales los los sitio dónde estarían dispuestas a comenzar una conversación y que temas son son tabú o harían qué se retiraran. ",5,14,1719175364.0
¿Que hacen cuando se maman de trabajar?,"Estoy algo mamado del trabajo y siento que no he mejorado desde que entré, me siento tan quemado que no puedo ni disfrutar findes pensando en el trabajo, me gustaria oir opiniones",13,20,1719175030.0
Necesito pedir un préstamo urgente y no en donde,"Tengo 19 años y mi vida acredicia se ha basado en pagar mi plan de celular hace ya casi 7 meses y siempre lo hago juicioso, el caso fue que ayer iba saliendo de mi trabajo con todo mi dinero, tenia casi 800k en la billetera y de un momento a otro me atracaron entre 2 tipos, yo ese dinero lo tenía para pagar mis deudas y resulta que mañana se cumple la fecha de pago de lo que tenía que pagar y no me pueden dar espera de nada, necesito saber donde puedo pedir un préstamo para ver si puedo pagar mis deudas y en el transcurso de estas 2 semanas pagar lo que me prestaron Pero no en dónde hacerlo...",2,4,1719175005.0
"Si trabajando entre sector privado y publico sumo 795 semanas cotizadas para pensión y soy mujer, con esto de la reforma pensional como quedaría mi situación? Qué procede? ","Sumo 795 semanas a la fecha. Pregunta muy seria, gracias de antemano a todos los que hacen parte de este maravilloso subreddit",1,0,1719173445.0
Consejo: Hidrolavadora para aires,"Estoy pensando en comprar una hidrolavadora para hacerle mantenimiento a mis aires, pero además necesito una boquilla de 90° por la posición actual de los aires. 

Alguno conoce una combinación costo efectiva para esta necesidad ? He visto varios opciones pero no sé si las boquillas son compatibles con la hidro :(

Gracias 🙏",1,0,1719171951.0
"Hola todos necesito consejos para evitar la caída de cabello estoy dejando de crecer mi cabello pero la caída es excesiva , no uso gorras necesito consejos ..",,1,3,1719171531.0
Programadores: entre java y JavaScript cual de esos lenguajes recomiendan para fortalecerme y entrar en el mercado laboral?,,0,3,1719170617.0
Dudas sobre Mercadolibre Colombia,"Buenas Tardes, quisiera saber de alguien que conozca a profundidad como funciona Mercadolibre en Colombia.

Si un repartidor de Mercadolibre entrega en otro domicilio el producto, es decir que no lo entrega prácticamente. Se pone la queja y dan el reembolso del dinero. Ese monto se lo cobran a el repartidor?

Buena Tarde",1,4,1719169913.0
Consejos para prácticas ,"Hola, soy estudiante de ciencia de datos, en una universidad de Colombia, actualmente he seguido el consejo de conocer personas y hacer contactos, estoy en un semillero que a nivel nacional ya se está escuchando su nombre, incluso han participado en competencias y les ha ido muy bien.

¿Que pasa?, dentro de un año tengo que hacer prácticas, quiero hacer a nivel internacional, siento que apuntarse aquí en Colombia es muy mediocre ""es mi opinión"", no descarto que la vida me dé su golpe y me demuestre lo contrario, aún así voy a intentarlo, ¿Algún consejo?.

Pd: ya estoy practicando inglés, ya casi llego al B1 falta poco. 
Pd: en el semillero hay muy buenos contactos, pero no quiero depender de ellos por el momento.",2,4,1719169692.0
No se si hice bien con mi novia,"Pasa que mi novia ya termino hace 1 año y medio con su ex y nosotros llevamos 5 meses de relación, ella suele guardar los recuerdos de todo mundo en su armario pero aún guarda lo de su ex y a mi me incomoda, ya le notifique mi disgusto hace mucho algo más de mes y medio pero aún no a votado todo eso, según ella dice que es porque no a tenido tiempo y prefiere ordenar todo su cuarto y hacerlo pero no a tenido tiempo... 

Yo le dije que si no votaba eso no esperara un regalo de mi parte (porque hasta mis regalos los deja donde están los de su ex) y hoy discutimos y le dije que teniendo el dinero y todo no le di regalo De mes porque yo ya le había dicho a ella hace un mes que si no votaba eso no me nacía darle algo... a mi opinión no veo necesidad de guardar algo de una ex pareja como lo que ella guarda (FOTOS, DIBUJOS, Y COSAS ASÍ)

Que opinan, hice mal o sigo en mi posición de firmeza?",0,51,1719167653.0
Cómo caerle a una mayor ,Necesito consejos de cómo caerle a una señora o para mí una compañera de trabajo es mayor que yo por 15 años pero no importa hay que dan de consejos o que ,3,15,1719166431.0
"La saga Doña Segunda: propaganda anti-gobierno 100% emocional, 0% sustancial ","- Doña Segunda es un piqueteadero bastante grande y que factura más de $148 millones de pesos/año (probablemente más). Tienen más de una docena de empleados. Tienen para cotratar contador y la vieja no administra. Tiene una nieta estresada de la Sergio Arboleda en finanzas que trabaja en dicho negocio. 

- Según Última Hora Caracol reveló que la DIAN había visitado el piqueteadero el año pasado para explicar la facturación electrónica. Se le advirtió… 

- Revelan la información relevante después de que el daño fue hecho: la gente en su mayoría defendió a la pobre anciana “inocente” contra un gobierno agresivo e injusto. Que conveniente…  

- Le echan la culpa a la administración Petro, pero la facturación electrónica venía desde el 2018… 

- La evasión de impuestos es un crimen y le hace daño a toda la población. Dejen de defender a evasores de impuestos. ",41,54,1719166393.0
"Alguien puede tirar un video de YouTube? Le pago, pero es de un programa muy reconocido ",,1,3,1719163476.0
Traspaso moto,"Heyy parcer@s, un poco de contexto rápido. Mi hermana compro una moto ya hace un tiempo y se sacó a mi nombre... El caso es que ya se tuvo un inconveniente con una multa la cual quedó a mi nombre etc.. ya se va a pagar peeero para ""curarme en salud"" quisiera saber si alguno aca sabe o me podría recomendar que trámite es posible para que yo no tenga que ver con la moto... El traspaso como tal no es una opción a corto plazo porque me tocaría asumirlo a mi... Y mi hermana la verdad es una irresponsable... He escuchado sobre compraventas pero no tengo mucho conocimiento... Muchas gracias!",1,1,1719160934.0
Que tal es la rappi cuenta?,"Hola gente, les quiero preguntar qué opinan sobre la rappi cuenta y su retribución por guardar el dinero allí, tengo pensado meter como mínimo mensualmente 700k a 1M, sería rentable? O que sugieren?",2,7,1719160439.0
 ¿Cuál es tu plato típico colombiano favorito? ,"Hola ,Soy un amante de la gastronomía y me encantaría saber cuál es el plato típico colombiano favorito de esta comunidad. Colombia tiene una increíble variedad de comidas deliciosas, y me gustaría conocer sus preferencias.Para hacerlo más interesante, he creado una pequeña encuesta para que todos puedan participar. ¡No olviden dejar un comentario explicando por qué es su favorito:

1. Arepa
2. Bandeja Paisa
3. Ajiaco
4. Sancocho
5. Empanadas
6. Lechona
7. Tamal",27,76,1719159849.0
Cómo dejar de pensar tanto en la intimidad.,"Hola, quiero recurrir a ustedes por ayuda, la verdad mi relación está peligrando y quisiera encontrar alguna solución de por medio mientras voy al médico ya que es demorado.

Resulta que con mi pareja, que llevo 6 meses, ella tiene 22 y yo 23 estamos teniendo problemas para la intimidad, el problema es que aveces no logro tener una erección bastante buena para hacerla disfrutar y cuando la tengo puedo eyacular muy precoz.

He leído artículos sobre que puede ser ansiedad sexual sobre estar pensando en cosas de que no va a funcionar o que no voy hacer disfrutar a mi pareja, pero el dia de ayer ella me contó que ahora le afecta de alguna manera porque cuando vamos hacer eso ella se llena de expectativa pensando que será diferente y aveces no en todos los casos funciona bien y ya se hace algo personal porque ella cree que es porque no me gusta o físicamente no me atrae o cosas así.

Se que el principal problema sucede cuando sobre pienso mucho en todo, en problemas, o que antes de mi ella era promiscua, o que no seré suficiente, apesar de todo eso ella siempre me recuerda que me ama y me apoyará con eso, y me siento bien con eso pero se que en el fondo no todo es así, en cosas así, y es que como me dice ella uno quiere tener relaciones es como para desestresarse de todo un poco y es verdad, y más cuando es en pareja.

Encerio de corazón quisiera sus mas amables consejos que hacen o normalmente si suelen pensar en algo para no pensar en nada o relajarse, o que estoy haciendo mal, o como centrarme solo en ella y en el momento, trato de respirar en el momento para que todo ayude pero igual es difícil.
Agradezco sus mas amables consejos.

Adicional cuando fui al médico me mandaron unas pastillas que me ayudan a regular las emociones me ayuda al sexo pero quiero saber otra opinión.",16,26,1719159686.0
Entre 🇨🇦 y 🇺🇸 con sus (TLC's) nos van a quebrar!,"O mejor dicho las multinacionales de estos amables paises.

Me explico: 

Colombia en estos momentos sufre litigios por un valor de 51 billones, algo equivalente a las dos reformas tributarias de petro eh :v.

Casi todos por multinacionales mineras extranjeras y el caso del Galeon San Jose.

Lo interesante es que todos se estan aferrando a los acuerdos TLC con  🇺🇲 y 🇨🇦 incluso los de la sea search armada!, para exigir indemnización.

Delirante no! :D

Que adivinen de donde sale esa platica?

Exacto! de nuestros bosillos en impuestos! :D

Ya perdimos en La Haya, estamos que perdemos el caso glencore y el caso eco oro, hay otro caso de Gran Colombia Gold, pues los laudos parecen no ser definitivos.

Como siempre se ha dicho perdimos nuestra producción de trigo, la de cebada, en el 2026 la de leche en el 2030 la de pollo para que no me digan los neolibertontos y libertontos que es que colombia no tiene la capacidad y nunca sería capaz de producir alimentos para si misma,en este caso autoabastecerse de pollo pues ya lo hace.

Los municipios donde mas se explotan petroleo, gas, minerales, son los mas pobres de Colombia Yopal ni tiene acueducto.

Yo les pregunto a los libertontos y neolibertontos

¿Que pt's estamos ganando con estos TLC?!!! 

Por que hasta donde veo si ganamos! Pero desgracias!!!!!!.

[Edit] y no olvidemos que ahora nuestra balanza comercial con USA es negativaescenario diametralmente opuesto a antes de la apertura...

[2 edit] y ojo con Serranilla y Bajo Nuevo que de pronto por ahi a una multinacional gringa le da por hacer algo y ahí si que nos clavan PEOR!!!!",0,28,1719159466.0
Familias en stean,una pregunta alguien sabe cómo puedo entrar a la familia de steam de alguien de españa estando en Colombia? ,0,1,1719159338.0
"Siento que es muy difícil hacer nuevos amigos, pero no entiendo por que.","Me explico, no es como si yo estuviera completamente solo actualmente, afortunadamente estoy en una relación en la que me siento muy feliz con mi pareja y sigo saliendo muchísimo con mis primeros amigos del colegio con los que seguimos muy unidos. 
El problema real viene cuando trato de hacer nuevas amistades de cero, digamos, ya estoy en mi último año de la universidad y siento que casi no hice ningún amigo real en todos estos años. No entiendo por qué, si yo intento ser amable y agradable con las personas que conozco, trato de escucharlos si quieren decirme algo y de fomentar los lazos con las personas con las que ya he hablado un par de veces. 
Aún así, siento que mis esfuerzos son en vano porque yo creo que las personas no me ven realmente como un amigo cercano, sino simplemente con alguien agradable con quién hablar y ya. Siempre pensé que era por qué no compartía tantos gustos con las personas con las que hablaba, es decir, no soy mucho de fiestas y eso (aunque si he ido un par de veces y trato de hacer buen ambiente), pero hace poco, incluso con personas que pensaba que teniamos muchas cosas en común sigo sintiendo que no logro que me vean como un amigo real. 
No sé... Eso me hace sentir triste, porque siento que mis esfuerzos siguen siendo en vano y no logro que las personas quieran profundizar su amistad conmigo, sobre todo ahora que estoy terminando mi universidad y siento que me llevo muy pocos amigos de ahí...",3,10,1719156249.0
Creo que los videojuegos ya casi no se preocupan por el público adulto,"Desde pequeño siempre ha sido mi hobby jugar videojuegos, verdaderamente es algo a lo que siempre le he metido tiempo y plata, sin embargo últimamente se me dificulta mucho jugar, en el sentido de que me estresa que los juegos estén sobrecargados de contenido, como muchísimas cosas por hacer y toda esa vaina, también está esto de los que son muy competitivos y si no juegas lo suficientemente bien no vas a disfrutarlos,. Tengo ya casi 27 años, me gustaría pensar que es porque estoy envejeciendo, tengo un trabajo que me ocupa 6 o 7 horas del día y tengo una relación muy bonita también que verdaderamente no se cruza para nada con mis hobbies.

Ustedes qué creen que sea? O simplemente no estoy eligiendo bien mis gustos, también puede ser que mis compañeros solo juegan una o dos cosas (Wow y lol)

El último juego que disfruté fue Hellblade 2, soy jugador de PC",18,49,1719156244.0
Recomienden paletas de sombras colombianas o fácil de conseguir en Colombia ,"Mi paleta todo terreno se quebró :( era china y pues fue un regalo pero me sirvió en muchos de mis eventos importantes. Necesito que tenga tonos tierras, rosados tipo pasteles y unos que resalten como blancos, plateados o dorados. Hace mucho no miro el mercado, ¿alguna que me regoneinden?",1,6,1719155004.0
Mejor manera de vender un carro,"Tengo un Sprint modelo 1995 para la venta. Quisiera saber cuáles son las mejores páginas para vender carros en el momento o qué medios me recomiendan para venderlo, aparte obviamente de venderlo directamente con un conocido o algo así.",1,4,1719153682.0
Invertir en fracciones de edificios/hoteles ¿Cual es el truco? ,"Lo que dice el título. Últimamente estoy viendo mucha publicidad de ese estilo en la que invierte uno 100-250 millones y le dan mensual entre 800 mil a 1.6 millones, con sus respectivas proyecciones de rentabilidad anual sujetas a la situación futura.

 Por ejemplo hay una para comprar una fracción del Hotel Hilton en Santa Marta. Mi pregunta es como funciona eso? Es uno realmente dueño de una fracción? Es sobre la tierra o sobre el negocio? Porque si es el negocio entonces son prácticamente acciones, y cuan líquido puede ser la venta de esa fracción? En Colombia hay mucho negocio Chimbo o que tiene mucho vacío en términos legales entonces no me fio casi, hay alguno acá que haya invertido en eso o que trabaje en ese cuento? ",1,5,1719153460.0
Dame una historia ,Gente me pueden dar historias cortas pero contundentes es para un trabajo del colegio las historias pueden ser de lo que sea hasta de fantasía pero lo difícil es que tiene que ser muy cortas como un chiste porfavor ayudenme gracias ,1,3,1719149595.0
Herida de la madre,"Buenas, por favor recomienden libros que me sirvan para identificar y sanar la herida de la madre, he notado que repito en mis acciones algo que no tolero de mi madre y no quisiera eso para mi vida
",1,4,1719145335.0
Creer o no Creer ,Razones por las cuales no creer en Dios y razones por las cuales si creer.,1,48,1719144119.0
¿una persona calva tiene que echarse bloqueador solar en la calva?,,1,7,1719136172.0
