title,text,score,num_comments,created_utc
Ayuda esto tiene que parar ,"( esto va hacer largo pero es mi historia real con mi acosador) 

Mira a finales del 2021 yo estaba aburrida porque ya habia salido del colegio y tras de eso estabamos en pandemia aqui entonces no tenia nada que hacer hasta entrar a la U en enero del 2022, entonces a finales del 21 me descargue una app rusa que se llama VK solo para pasar el rato porque es parecido a Facebook pero en su mayoría hay gente de Rusia, resulta que en mi cosas para buscar amigos me apareció en recomendaciones un chico llamado Nikolai  el no me llamaba la atención pero de todos modos le di seguir para tener amigos ( la cuenta de el era privada ) al rato el me acepta la solicitud y al intante me llega un mensaje de el ( en ruso ) estuvimos hablando y le menciono a el que puedo al menos comunicarme lo basico en ingles pero definitivamente no en ruso, El se las ingenio para hablarme en inglés entonces todo bien solo éramos conocidos.... 
el no se me hacía atractivo ni nada porque es un chico del otro lado del mundo que habla otro idioma y que puede ser fake, A los meses de hablar con el de chill el empieza a interesarse en mi ya ah este punto el sabe que soy latina que hablo en realidad español y bueno el empieza a dar señales no tan claras pero si señales... yo no les preste atención porque en mi mente solo eramos amigos, La costumbre de él al darme atención hizo que el tiempo después y claramente sintiera atracción por el... aún así yo tenía los pies en la tierra porque como les dije es una persona en otro país pero tarde o temprano terminé cayendo.... Me termino gustando el y es ahi donde empieza todo lo malo... El me empieza a manipular que quiere ser mi novio pero no se que, que esto y que lo otro y me lavo el cerebro totalmente Terminé haciendo cosas que no quería hacer el me empezó a manipular mas y me empezó a usar, a mitad del año 2022 el se aburrio de mi y me dejo sin más, Claro eso me afecto mucho porque ya el me tenia el cerebro lavado... y pase muy mal lo que quedo de ese año... Fatal fatal... yo no me reconocía... Pasa año nuevo para 2023 y en febrero de ese año el me vuelve a escribir.... 
esta ves suplicando que le perdone y que queria regresar conmigo 
Yo de tonta le creí pero le marqué un límite de qué no quería nada que ver solamente solamente una simple amistad , yo lo intenté juro que lo intenté mantener todo en control pero me volvió a lavar el cerebro otra vez... y volví a hacer cosas que no quería hacer, A mitad del 2023 yo empecé a abrir los ojos me empecé a dar cuenta de todo lo malo que estaba haciendo me traté de alejar, a él ya darse cuenta que yo me estaba dando cuenta de las cosas me empezó a tratar peor me amenaza, me insultaba, me decia mucha mierda incluso tenia fotos de mi ( ya sabes de que tipo sin mi consentimiento que el me obligaba a mandarle tiempo después de que yo me rebelara contra el) con lo cual me estaba amenazando en publicar, Lo recuerdo claro... también decía que hacia todo eso con la excusa de qué no haría nada de eso si yo me volvia su puta Yo sentia que me iba a morir.... todo ese tiempo me enferme mucho tanto físicamente y psicológicamente, todas las enfermedades y todo lo que me enfermé y hoy me siguen son consecuencia de todo lo que pasé esos años.... A finales de 2023 él me pide perdón con un mensaje de texto kilométrico y me dice que no me va a volver a molestar,  Yo quede ""tranquila"" pensando que al fin iba a tener paz le acepto la disculpas y pierdo comunicación con él En Año Nuevo de este año... Me llega un mensaje de él felicitándome por el año nuevo diciéndome que esa misma noche había ido a un bar a hablar con sus amigos que se había emborrachado un poco y le había contado a ellos de mí... Yo le dije que por favor y que dejara todo atrás y que no me volviera a molestar, a los días después me llega mensajes de otros números llamadas más amenazas de qué me iban a hacer todo si no volví a ser su puta. Tuve que cerrar todas mis redes sociales, hacer las privadas, borrar Facebook borrar Telegram Instagram saber a quien se lo puedo dar mi información y quien no esa también fue una de las razones por cual cambié Telefono también. En unos momentos de desesperación un Domingo casi medio dia hable por Instagram con la mamá y la mamá no me creyó nada me bloqueó, hablé con el padre el padre le contó a él y él se terminó enojando más conmigo y termino diciéndome que le pidiera disculpas a su padre y que le dijera que era mentira. Claro Nikolai él negaba todo porque como me escribía de otros números que no era el, yo no pude aprobar que era el... Llegue al punto de fingir mi muerte... Es lo único que hasta de momento me ah funcionado... pero días aleatorios de la nada me llegan mensajes de el, me vuelve a escribir por WhatsApp. 

El fingió que le habían hackeado el teléfono o la computadora y utiliza números de celular prestados de aplicaciones que permite eso para siempre acosarme. 
Se que surgen preguntas obvias como ¿porque no cambiaste de numero? ¿No puedes denunciarlo? ¿Porque le enviaste  fotos de tu cuerpo a el? Y muchas preguntas obvias... 

Cuando empezó todo yo tenía 17 años... ya tenia problemas, no tenia algo de estabilidad me agarro en un momento vulnerable, claro que intenté cambiar de numero lo hice 2 veces y al parecer WhatsApp ya avisa cuando cambias de número entre otras aplicaciones, nunca lo bloquee tenia dependencia emocional el me había lavado el cerebro... yo tenia todas las de perder... no es sencillo decirlo y hacerlo mucho menos cuando no tuve ningún apoyo mas allá de los burlas, comentarios juzgándome y entre otras cosas que me hundieron más... hable con abogados pero solo me dijeron que en casos así no podemos hacer nada hasta que haya algo... es una mierda saben..? 
Hoy tengo 20 años y me aterra escuchar el sonido de notificación de mensaje, tengo miedo, vivo con suspenso, con inseguridad y vivo incomoda. 

Escribo esto porque esto continuara porque ya se ve que nunca acabará no se podrá llevar a términos legales pero al menos me quedare con que lo dije, es como si yo estuviera escribiendo escribiendo el guion de una serie, Necesito que esto llegue a más personas se que habrán personas que conocerán a este chico, personas que no me crearan y se que habrán personas que si. Yo les pido por favor no juzgarme ya tuve suficiente. 
Admito que no estuve bien mentalmente y llegue a normalizar actos que el me hizo que ahora reconozco que no estuvieron bien, en mi momentos más bajos llegue a créele muchas de las cosas y hice lo que no estaba bien. Constantemente el lavaba mi cerebro tratándome mal y luego disculpándose generando una rutina de esto mismo.  Yo genere dependencia emocional a el lo admito pero yo estaba tan ciega en mentiras que no veía el abuso que el me hacia, si llegue a tener conversación con el de suplicando de que yo solo quiero una vida normal y que quería una relación normal que no podía darme eso, pero como dije yo tenia una dependencia emocional hacia el... ahora reconozco que todo estuvo mal y ahora mas que claro me quedo el tipo de persona que es el. 
No eh dicho esto porque sinceramente me d vergüenza de lo que pase y hasta me eh llegado a sentir menos mujer para mis futuras parejas, eh tenido problemas bajos de autoestima y problemas con miedos 

No digo mi nombre porque si esto llega a las manos incorrectas solo me quedare con el enojo de el de por vida, Nikolai si estás leyendo esto por favor ya déjame sabes perfectamente quien soy. 

Hablo de Nikolai Poltko 
Hijo de Elena y Vickor Poltko 
El tiene hermanos. 
Tengo tus redes sociales, tengo fotos de ti, tengo la conversación con tu madre, tengo algunas capturas de pantalla con nuestras conversaciones. 
Tengo tu correo electrónico, dirección y canal de YouTube. Se quienes son tus amigos. ",4,5,1719126197.0
Realice las practicas del SENA pero no he podido seguir trabajando,"Estudie en el SENA un técnico de Mantenimiento e instalación de sistemas solares, fuero 6 meses que estuve haciendo las practicas y fuero los 6 meses que experimente viajar a zonas rurales en el departamento del cesar (imagen de ejemplo), pero luego de terminar las practicas estuve esperando que el SENA me enviara el certificado de técnico el cual ya tengo, pero la empresa en la que realice las practicas ya no esta contratando personal, tengo el problema que ahora estoy desempleado y metiendo hoja de vida en diferentes empresas, que recomiendan hacer, en este caso.

https://preview.redd.it/ygd0x9buq98d1.jpg?width=1600&format=pjpg&auto=webp&s=7a4c6b7ae205f4405c096efd776abbae9b65a600

",2,2,1719125510.0
Conocen algún Temach para maricas?,"Bueno, es mi turno...

Invite a un amigo/novio/loquesea a su cumpleaños a Santa Marta.

Le pagué vuelo, hotel, alimentación y toures.

Fuimos a el Rodadero. Todo el tiempo se pasó con el celular y no con nosotros en el mar.

En la noche termino saliendo con sus super amigos y al terminar la faena, lo dejaron botado en la PM.

Le toco venirse a pie y en el camino supuestamente lo atracaron.

Termino por contar un montón de historias al llegar y que le pagará el taxi de vuelta de su salida a putear.

Lo mandé a la PM y ni idea de dónde está ahora, se supone en el Rodadero en un apartamento de un amigo de el que maneja ""un Tesla"".

En fin, me siento mal por haberlo sacado del hotel y hoy en su cumpleaños ni idea como la estará pasando. 

Al hotel no puede volver porque ya fue reportado como expulsado por la policia y el administrador se calienta con la policia de turismo si lo deja entrar.


Sentimientos encontrados, en fin...",0,7,1719124255.0
