title,text,score,num_comments,created_utc
NECESITO PERSONA QUE TENGA EXPERIENCIA EDITANDO Y GRABANDO,"Persona con todas las ganas de trabajar con un buen sueldo, vivienda y servicios. Buen ambiente laboral, ubicado en Medellín o dispuesto a venir a Medellín. Para más info inbox",1,0,1719248754.0
Quien de Barranquilla pa culiar,15 años (soy hombre ),0,5,1719247642.0
"Comparendo por consumo de marihuana en parque publico (Bogotá, Colombia)","hola, soy bogotano el día de ayer domingo me encontraba fumando medio porro encontré tirado (puesto por diosito) el hecho es que me senté en un parque y comencé a fumar , pasaron 10 minutos llego la policía siempre con actitud rancia realmente no me exalte siempre hable con respeto, no me tome la situación enserio, pero les molesto bastante mi actitud no porque actuara violento, exaltado o irrespetuoso mas bien por lo risueño y relajado porque como digo no me parece una situación que requiera tanta atención ni mucho menos tanta intolerancia por parte de la policía, no fui capaz de grabar , hace poco leí que grabar esas situaciones era beneficioso (hoy lo leí) el hecho es que me pusieron un comparendo y decidí apelar y realmente no se que procedimientos o que debo hacer en esta situación.",0,1,1719247597.0
Busco millonario ,"Hola🥺 
Busco millonario que inyecte capital a mi emprendimiento para salir de la pobreza, tengo las herramientas necesarias 🤓 solo me falta el money🤲",0,10,1719244672.0
¿Ustedes son productivos en el trabajo?,"Se ha hablado bastante con estadísticas de como Colombia es de los países que más horas trabaja de los que pertenecen a la OCDE y que curiosamente es de los menos productivos, esto tiene muuuchas razones como la educación ineficiente, equipo de trabajo anticuado, capacitación paupérrima, etc.

Con eso en mente ¿Ustedes rinden en el camello? ¿Qué consideran que es lo más importante en su rendimiento o que es lo que más determina su falta de productividad?

",2,4,1719244661.0
...,"https://preview.redd.it/vp0i0tsmjj8d1.png?width=1414&format=png&auto=webp&s=8bc5936b9259423cbd9a67be9a26cf02d9b132e7

fuente: [https://mapsinterlude.wordpress.com/2024/06/24/the-best-countries-for-retirement-in-according-to-2024-annual-global-retirement-index/](https://mapsinterlude.wordpress.com/2024/06/24/the-best-countries-for-retirement-in-according-to-2024-annual-global-retirement-index/)",1,0,1719244531.0
Visado PAC ,"Yo tengo visado PAC. Soy medico colombiano. Deseo que mi esposa venga a españa a acompañarme. Se que la visa pac me permite traer a mi familia y he leido los requisitos en la pagina web de la embajada pero tengo duda en el punto 4 el cual dice: 

""Autorización de residencia. Original y una copia de la autorización expedida por la Unidad de Grandes Empresas y Colectivos Estratégicos.""

Esta ""autorizacion de residencia"" es la que me dieron  a mi al momento de obtener el visado PAC? O mi pareja tambien debe tramitarlo?

",2,0,1719243742.0
"Si hay hombres que buscan reemplazo de su mamá en una pareja, ¿habran mujeres que buscan reemplazo de su papá en una pareja?","Ustedes que piensan, yo personalmente creo que si ",7,20,1719243402.0
Cambiar usdt a usd billetr,"Hola, en bogotá conocen algún lugar o alguien que cambien usdt por dolar billete o en su defecto pesos?
Principalmente off the record
Gracias",2,0,1719243365.0
Qué tal el descaro?,"Hola, gente.

Resulta que salí a comprar la comida de mi perro haciendo uso de las piernas que la vida me dio y caminando por la acera me encuentro con que la mayoría de vecinos han decidido sacar de sus antejardines una extensión de rejas para poder cuadrar sus carros adentro, ocupando espacio del peatón sin importar que a uno le toque bajarse a la calle por donde pasan los carros.

Puede sonar tonto pero me parece un descaro de la gente que en vez de reducir el espacio para adentro de sus casas quieran quitarle el poco o nada de espacio a la gente que camina o anda en silla de ruedas.

Saben en Cali donde se pueda denunciar estos atropellos? ",5,3,1719242565.0
¿Qué opinan de la fuga de cerebros?,¿Debemos preocuparnos? ¿Cómo afrontarlo?,3,12,1719242382.0
"gente que ha importado cosas de USA a Colombia, que casillero recomiendan?","he estado pensando en comprar un par de cosas por casillero pero que servicios recomiendan, he escuchado de muchos, wuuju, byorder, encargomio, woosh y demas, pero no se cual de esos o que otro sepan que no te dejen en visto, no sea muy caro, sea confiable y con bastante reputación? agradezco recomendaciones, feliz lunes.",2,9,1719240806.0
Pregunta para gente fitness.,"Este año me comprometí a estar juicioso con la actividad física y el ejercicio. En aras de lograr ese objetivo, hace 15 días empecé con una instructora personalizada que, además de las rutinas propiamente dichas, me orienta en cuanto a cómo debo alimentarme. 

Cabe señalar que esta persona me la recomendó alguien del gimnasio al que voy. Además, que esa opción me pareció bastante viable porque estoy, por cuestiones laborales, en un lugar bastante remoto.

Sin embargo, hay una cuestión que empezó a hacerme mucho ruido: luego de pedirme que comprara proteína, creatina, un pre entreno (cosas que esta persona vende), me solicitó que debía comprar y consumir ligandrol, bajo la premisa de que con ellos se obtendría resultados rápidos, entre otras cosas.

De inmediato, le respondí que eso del ligandrol no era una opción para mí, puesto que temo a los efectos secundarios que esos fármacos puedan tener. Con la proteína y la creatina no tengo lío.  De hecho, ya consumo la bi pro classic, aunque ella dice que es mala y que debe reemplazarse por la gold standard. 

Al respecto, esta persona se molestó bastante pues afirmó que estaba poniendo en duda su profesión. Entonces, me envió otra serie de cosas que debería consumir si no tomo el ligrandol. 

Mi duda es, ¿estoy errado en tener reservas con el hecho de consumir cosas como ligandrol y, por ende, son necesarios para tener resultados en el gimnasio o, por el contrario, es valido el malestar que me genera esa indicación tan solo a dos semanas de empezar la asesoría? ",8,23,1719239684.0
Any good bars in Brooklyn NY to watch tonight’s Colombia v. Paraguay game?  ⚽️🍺,,4,2,1719238727.0
Opciones de europa para emigrar,"Tengo en mente emigrar a algún país en busca de una mejor calidad de vida, soy ingeniero en teleco y ando en proceso de sacar un ccna, ando explorando oportunidades pero talvez muchos acá sabrán o inclusive ya lo han hecho, cualquier consejo es válido, frente a idiomas solo hablo español e inglés",1,1,1719238707.0
¿Se puede dejar de ser narcisista?,"En contexto llevo casi toda mi vida siendo un completo narcisista... Digo no se si se logre tratar o cambiar o si ya es parte de uno mismo y no tenga solucion, pues aunque me he visto con psicólogos nunca me lo mencionaron, nunca me trataron siquiera de decirmelo, quizás es difícil de detectar. Me imagino en mi caso será costoso 😂 

Edit: me gustaría saber quiénes trataron este tema o solucionaron ya que desconfío mucho de lo que recetan aveces o como tratan algunos profesionales",4,38,1719238197.0
Quiero creer que mi vida es the Oficce,"Es una mamada lo se, solo trabajo como QA en una oficina Xd y ustedes sienten ese complejo?",0,7,1719234221.0
Income,"I'm curious, I have a friend that's sending money to this woman and I wonder why she needs it, she's a sports reporter she travels because of it and she has a fairly large store .
So my question is how much would a person would have to make to feed 2 doing all that. FYI I'm not the only one worried so it's his mother, brother ect we seen  what she does its not that we don't believe she does what she does . We just think there's a catfish somewhere in there.",7,7,1719230485.0
La tienda más económica de colombia para comprar un pc ensamblado?,,4,3,1719219311.0
Atención a todos los campesinos o a quienes conozcan campesino,"Si alguien es campesino o conoce campesinos en Colombia, por favor envíe un mensaje directo.  Hay un incentivo financiero para quienes deseen ayudar. Gracias",1,1,1719218124.0
Ayuda bro,"Me cree una cuenta brazzers, y me metí a un link que me dieron y cancele las 2 suscripciones, dicen activas por que compre 2 dias, si ya cancele eso pero no me llegó nada al correo no me va llegar ningún cobro no? 
",0,4,1719213837.0
"Alguna recomendación de donde puedo buscar videos o páginas de morenas , o canales en telegram ;) ",Recomienden canales ,0,4,1719213265.0
Virgen a los 22,"No sé si hay algo malo en mi , parce tengo 22 y pues tengo vida social amigos de universidad, de infancia y todo bien, voy al gym, pero siento que todo mundo tiene novia o ha tenido experiencias con mujeres, yo lo máximo que he tenido es besos con amigas y ya , yo sé que debo tener actitud y personalidad ante la vida, pero voy a decir algo grosero y egoísta ( lo mismo dirán de uno) pero he visto Manes re Pailas con mejor vida sexual que yo jajaja , solo quiero desahogarme porque no se si es que soy un bicho raro ",0,15,1719212804.0
¿Como conseguir camello siendo menor de edad? ¿Qué aptitudes he de tener?,Soy menor de edad pero quiero trabajar pero no se donde buscar ni en que lugar me podrían dar camello. ¿Consejos?,1,7,1719209907.0
"La gente habla mal del pintor austriaco, pero el verdadero villano siempre será el ser humano","No les parece curioso que solo basta una sola persona con algo de parla para hacer que el hombre sea incluso más vil que el peor de los demonios, sin importar a que bando le jueguen en mis 30 años de vejez he aprendido que un 70% de la humanidad es perversa, estarían dispuestos a hacer cualquier cosa por un poco de poder o creer que son más que otro, además de que las masas son muy fáciles de adiestrar.

  
Pienso que la religión logra calmar a muchos, bueno, algo útil tenía que tener, son como perros con correa, solo basta soltar un poco de odio por aquí, venganza por allá, dinero aquí y una pizca de poder y ya tenemos a un feroz animal dispuesto a matar, violar, torturar y humillar a quien se le atraviese.

  
Hablando del pintor austriaco, solo era una persona, muy inteligente de hecho, pero quienes cometieron atrocidades inhumanas, no fue él, fueron las masas a su mando. 



  
",0,5,1719209671.0
Como hago para que me perdone?,"Contexto: mi novia esta furiosa conmigo porque le oculte una cosa, nosotros tenemos una amgia en común, Gabi (la ex suegra de ella, el hijo esta fuera de la ciudad y ya tiene nvia), yo me volvi muy amiga de gabi y era mi confidente y guia en problemas que me pasaban, bueno resulta que ella me conto que mi novia le escribio al hijo de ella, el mensaje era que queria darle fin de ciclo ya que ellos nunca se despieron el solo se fue, el mensaje era de exitos, que aun lo tenia en la mente y que le fuera bien en su relación. Yo me enoje por eso y invente que el exnovio me mando captura del mensaje que le mando mi novia, todo esto para no hacer quedar mal a gabi. Bueno pasaron 6 meses de eso y pues gabi se volvio cristiana y pues termino diciendole a mi novia la verdad, que fue ella la que me mando captura del mensaje. mi novia esta super enojada porque no le dije la verdad, que no confia en mi, que si yo oculte algo tan pequeño puedo ocultar hasta una infedelidad, etc. No se que hacer me siento mal que la cague y no fui sincero pero tambien pienso que no es para tanto, y que ademas yo le perdone algo mas grande que fue escribirle al ex (osea lo que me mando gabi)",1,3,1719209517.0
Gente floja que no le gusta salir,"Soy una persona que solo le gusta estar en casa encerrado jugando videojuegos,ver YouTube y estar acostado o haciendo algo en casa,no me gusta salir no soy muy sociable,inclusive prefiero estar en casa a menos que salga a compartir con amigos un rato pero como no tengo amigos :b,además soy muy introvertido,penoso y muy pervertido,entonces no tengo arreglo,me gustaría saber quién más en Colombia es así como yo de introvertido y algo aburrido(hay que admitir la verdad gente) yo soy de pasto(me mudé hace unos meses aquí a pasto :v no soy pastense)",1,4,1719208676.0
Como puedo ligar con una mujer mayor ,"Resumen: Tengo 18 años y me instalé Tinder para joder, nada más. Hoy ajusté mis parámetros en mujeres que tuvieran un rango de edad entre los veinte años y los treinta y nueve. Por joder, le di like a una vieja y hice match con ella. ¿Qué puedo hacer? Cabe recalcar que me envió un corazón apenas hicimos match.",1,6,1719207122.0
Comencé una relación a distancia con un paisa y tengo susto. ¿Será que le meto cañaña al asunto?,"Vengo a desahogarme un poco: c

Todo empezó en febrero cuando se terminó mi relación de tres años con mi último novio oficial. Bueno, la pasé muy mal, fue una horrible relación y tuve que gestionar muchísimas cosas. Aparte que trabajo con él en el mismo lugar, somos músicos.

Resulta y acontece que, a las dos semanas, conocí a alguien. Un muchacho la cosa más dulce y con una forma de ser espectacular. A parte que, físicamente es un papucho. Cuando empezamos a hablar, él me contó que se presentó a un grupo en Alemania (a tocar gaitaaaa, esas gigantonas que usan por allá) pero que seguro no lo llamaban. CUANDO VAYA VAYA, OH SORPRESA. al tiempo (1 semana XD) que estuvimos hablando, lo aceptaron en la banda. 

Y bueno, igual seguimos hablando porque lo que sentíamos era súper fuerte. Al mes de empezar a hablar, él se fue a hacer unos toques allá en Alemania y yo por mi lado a tocar por Colombia (porque también soy música). Mientras estaba allá, hablamos súper duper bien, cuando oh sorpresa, *LA EX SE LE APARECIÓ POR ALLÁ*. ¿Qué probabilidad había de que eso sucediera? me dejó de hablar. Claro, cuando volvió a Colombia a sacar y esperar la visa alemana, habló conmigo, fue sincero y quedamos mejor de amigos. Más que todo por el hecho de que al irse, sería más difícil soltarme

Al otro día no se aguantó, apareció en mi casa a decirme que andaba re loco enamorao, y yo aaaaaaa si pos yo igual. Pero, le dejé en claro que lo de la ex, cagada. 

Pasamos unas semanas re chimbas, paseamos, (nos)comimos, salimos, nos conocimos, pero nada que esa visa le llegaba parce, y él se me enloqueció. Me dejó de hablar de la nada porque no sabía cómo gestionar esos sentimientos :C

No hablamos por tres semanas, cuando me llama a decirme que *¡pummm!,* le llegó la visa y se iba en una semana. No sé cómo fue, pero el amor revivió (los dos la pasamos muy mal cuando no estábamos hablando) y un día antes de que se fuera, hablamos mucho tiempo de cosas que debimos hablar hace muchísimo tiempo. En conclusión, lloramos juntos, hablamos y terminamos entablando ahora si relación seria después de 5 meses de habernos conocido (y pasaron muchas cosas hahah)

En otras palabras, nos cuadramos y a las 2 horas nos despedimos por última vez en este país porque ya volaba al día siguiente. 

Ha ido muy bien hasta ahora, es muy lindo con mucho. Pero aún así me da miedo. Sabemos cuándo nos veremos probablemente. Pero la incertidumbre es dura, y no lo quiero perder 

¿Qué me recomiendan? pikos, gracias

Por cierto, estoy organizando una campaña para poderme ir a tocar (y de paso verlo D:) a Alemania

Si alguien puede ayudarme a compartir mi vaki (muuuuuuuuuu) sería wonderful, así sean dos lukitas",0,4,1719206440.0
¿Recomiendan comprar una nevera usada o mejor una nueva? ,"Necesito una nevera y estoy evaluando si comprar una nevera usada o una nueva. Conseguí un contacto en un grupo de facebook que vende neveras usadas pero no sé que tan probable sea que me vendan algo que se dañe en varios meses (ofrecen garantia de 3 meses ellos igual)

  
¿Que me recomiendan? ",1,3,1719204326.0
¿Como cuidar la piel del maquillaje de terror?,"Hace tiempo publique algo sobre que no estaba segura de trabajar en una atracción de terror pero eso lo superé y ahora lo disfruto, mi nuevo problema es ahora el maquillaje.
Para el trabajo a veces tengo que usar latex, papel y sangre falsa para heridas y todo eso, pero primero, la sangre es muy difícil de quitar, mancha mucho y la piel está comenzando a brotarse, uso productos como el desmaquillante y el jabón para limpiar la piel pero aún así se me brota la piel y ahorita estoy más preocupada ya que es temporada alta y uso mas seguido el maquillaje.
Que consejos me pueden dar para poder mantener la piel estable mientras trabajo?? Cómo me quito la sangre falsa??",1,0,1719202635.0
Estoy interesado en entrar en Lean Solutions / Staffing y tengo algunas preguntas,"Hola a todos, estoy interesado en trabajar en Lean Solutions ya que he visto comentarios diciendo de que es buena empresa. tengo experiencia en call center bilingüe de casi 1 año y medio en total, la mas reciente con Asurion de un poco mas de 9 meses, dicen que aceptan esa experiencia y la verdad estoy cansado de los call center y comentan que Lean no es call center como tal y es una de las cosas que mas me llaman la atencion.

Entonces si alguien conoce la empresa, trabaja o ha trabajado ahi, quisiera consejos de a que aplicar, recomendaciones, y un poco informacion general de como funciona todo, gracias.",1,0,1719201820.0
Que hago si no tengo ganas de nd,Bn lo q pasa es q de un tiempo para aca  no tengo los mimos ánimos de antes deje de hacer lo q más me gustaba o tras cosas q antes me las pasaba haciendo y ahora no me dan ganas de hacer las cosas q me gustaban antes aveces pienso q son solo bobadas pero llega un momento q me llega la pensadera y un vacío en el pecho aunque aveces ns no hallan razones de tristeza o de peso pa sentirme así es una sencion rara y pienso q ns mi vida de por si es aburrida donde casi no pasa nd y pss aveces pienso q pss tampoco tengo un peso en el grupo de mis amigos y pss uno es el protagonista de su vida pero aveces se siente como un personaje secundario y quisiera escuchar q creen q sea o q consejos me dan es la primera vez q escribo por aca,5,2,1719201262.0
Infidelidades que matan ,"Hola amigos, estoy pasando por una tusa ni la más difícil a raiz de la infidelidad del hombre que me prometió esta vida y la otra, pero salió con nada. ¿Que consejos me dan para superarlo? ¿Cuál ha sido su experiencia más dolorosa?. Los leo... ",1,6,1719200587.0
¿Dónde puedo conseguir un esqueleto human?,"Lo sé, suena un poco perturbador, pero no tengo una intención más allá que con fines educativos y de aprendizaje como estudiante. Sé que esto puede ser un poco o muy ilegal y hasta cierto punto inmoral. Sin embargo, mi interés radica en el estudio anatómico profundo que solo un esqueleto real puede ofrecer. Estoy buscando orientación sobre cómo adquirir un esqueleto humano real de manera ética y legal. Aprecio enormemente cualquier información sobre las regulaciones y procedimientos que puedan permitirme acceder a este recurso de forma legítima y respetuosa. Mi objetivo es aprender y entender mejor la anatomía humana para mi formación académica, y estoy comprometido a hacerlo de manera ética y legal, sin embargo, si existe otro método para obtenerlo que no sea muy…aja, pero seguro, me gustaría saber.",0,4,1719200176.0
Tengo 21 años y no se que carrera elegir ,"Siento que se me va el tren araña. Estudiar programacion o musica?? 

parceros pidos sus consejos, actualmente no hago nadasolo sobrepensar y ver que hacer con mi vida, llevo tiempo dedicandome a tocar guitarra y aprender programacion y diseño y aun no se que carrera se adecue mas a mi situacion.

Viendo lo visto con el tema de la programacion esta muy saturado de jr y me incluyo, y el temas de las IA, llevo vario tiempo mirando que rama me llama mas la atencion y el gameDev es lo que me gusta pero se que no es un campo muy comun y que haya mucha oferta actualmente, por otra parte el tema del arte de este y diseño y modelado 3d me gusta o me veria haciendo un proyecto relacionado

En música una U privada tiene buen enfoque en cuanto agrupaciones y exploraciones de generos populares y me gusta ese enfoque en vez de el de un conservatorio, por otra no soy mucho de tener conexiones y esto podría ayudar.




",0,3,1719199196.0
Experiencias con Agrap? ,"Hace poco me llegó un mensaje a wp donde una compañía llamada Agrap me ofrecia inversión en proyectos del campo colombiano, alguien ha tenido experiencia con ellos? Dicen que se obtiene exactamente 24% de EA.",1,1,1719199179.0
Un supuesto amigo que te vende con una mujer ,"No les pasa que es muy difícil mantener las amistades cuando somos demasiados reales en las cosas. 

Cuando crees tener una muy buena amistad con un supuesto amigo, contándole las cosas que dicen de el a sus espaldas, para que posteriormente se las cuente a las personas que hablan mal, diciendo quien fue el que se lo comento y asi hacerte quedar mal. 

Que bajo, que últimamente se ha perdido el concepto de lealtad por venderse al género femenino por quedar bien con una mujer, no culpo a las mujeres culpo al hombre en códigos bajos de lealtad. 

Todo el mundo habla mal de todo el mundo, pero desconocer un vínculo por quedar bien, eso sí me parece bajo. Simplemente es un desahogo.
",12,2,1719198675.0
Recomendaciones porfa,"Bueno yo quiero recomendaciones, 
Empiezo tengo una novia que es demasiado fría y la verdad se nota. Pero siento que no le género emoción cuando me ve o cuando estábamos solos o incluso puede llegar a ser cortante, puede estar conectada a redes sociales y no me contesta, casi nunca escucho un ""te amo"" si no lo digo yo e incluso me dice ""yo también"" 
Además con el mejor amigo(tiene novia) si se siente una mayor emoción cuando lo ve 

La verdad no sé que pensar o hacer",2,5,1719198577.0
Irme del país,"Tengo un dilema, o bueno me gustaría recibir consejos 
Este fin de semana voy a Miami de turismo y posteriormente Orlando a los parques no es mi primera vez allá pero ahora la diferencia es que soy adulto de 25 años y estoy considerando si quedarme allá 
No se allá cómo conseguir un empleo( igual sin miedo al éxito cualquier cosa aceptaría) pero no se temas de hospedaje de hecho el primer día no sabría qué hacer y por eso pido tips o recomendaciones de Uds ",1,9,1719195604.0
Le tengo miedo a las mujeres,"Hola parceros. Les cuento. No sé si de verdad es miedo o que. Lo que sí es que me da demasiada ansiedad el estar cerca de chicas o interactuar con ellas. Nunca he tenido novia o amigas, etc. Desde el colegio he tenido esa timidez extrema con las mujeres. Ya me aburrí de esta situación y quería saber si a alguien mas le ha pasado o que opina la gente con mas experiencia. Muchas gracias.",26,21,1719193818.0
Los fines de semana son horribles,"Cuando no tienes amigos o nada que hacer los fines de semana son una tortura, cómo hacen para distraerse?",21,50,1719190816.0
